"Language","original","english","czech","german","russian","polish","hungarian","italian","spanish","french","chinese","japanese","portuguese","chinesesimp",
"STR_CfgVehicles_SFM_ExoVestUn_Base1","The Heavy Armor Load-Bearing System is an effective means of weight distribution and comfort during constant movement and combat operations. This innovative system is designed to reduce fatigue and provide quick access to necessary equipment. Special pockets, loops, and attachments allow secure equipment mounting and rapid access to essential items in the most extreme situations. The load-bearing system is an indispensable piece of equipment for stalkers exploring the dangerous spaces of the Zone.","The Heavy Armor Load-Bearing System is an effective means of weight distribution and comfort during constant movement and combat operations. This innovative system is designed to reduce fatigue and provide quick access to necessary equipment. Special pockets, loops, and attachments allow secure equipment mounting and rapid access to essential items in the most extreme situations. The load-bearing system is an indispensable piece of equipment for stalkers exploring the dangerous spaces of the Zone.","Nosný systém těžké výzbroje je účinným prostředkem pro rozložení hmotnosti a pohodlí při neustálém pohybu a bojových operacích. Tento inovativní systém je navržen tak, aby snižoval únavu a poskytoval rychlý přístup k potřebnému vybavení. Speciální kapsy, poutka a příchytky umožňují bezpečné upevnění vybavení a rychlý přístup k nezbytným věcem v těch nejextrémnějších situacích. Nosný systém je nepostradatelnou součástí výbavy slídilů zkoumajících nebezpečné prostory Zóny.","Das Heavy Armor Load-Bearing System ist ein effektives Mittel zur Gewichtsverteilung und zum Komfort bei ständiger Bewegung und Kampfeinsätzen. Dieses innovative System wurde entwickelt, um Ermüdungserscheinungen zu reduzieren und einen schnellen Zugriff auf die notwendige Ausrüstung zu ermöglichen. Spezielle Taschen, Schlaufen und Befestigungen ermöglichen eine sichere Befestigung der Ausrüstung und einen schnellen Zugriff auf wichtige Gegenstände in den extremsten Situationen. Das Tragesystem ist ein unverzichtbarer Ausrüstungsgegenstand für Stalker, die die gefährlichen Gebiete der Zone erkunden.","Разгрузочная система тяжелого бронекостюма - эффективное средство распределения веса и обеспечения удобства в условиях постоянного передвижения и боевых действий. Эта инновационная система предназначена для уменьшения усталости и обеспечения быстрого доступа к необходимому снаряжению. Специальные карманы, петли и крепления позволяют надежно закрепить снаряжение и обеспечить быстрый доступ к необходимым предметам в самых экстремальных ситуациях. Разгрузочная система - незаменимый элемент снаряжения для сталкеров, исследующих опасные пространства Зоны.","Heavy Armor Load-Bearing System to skuteczny sposób na rozłożenie ciężaru i komfort podczas ciągłego ruchu i operacji bojowych. Ten innowacyjny system został zaprojektowany w celu zmniejszenia zmęczenia i zapewnienia szybkiego dostępu do niezbędnego sprzętu. Specjalne kieszenie, pętle i mocowania umożliwiają bezpieczne mocowanie sprzętu i szybki dostęp do niezbędnych przedmiotów w najbardziej ekstremalnych sytuacjach. System nośny jest niezbędnym elementem wyposażenia stalkerów eksplorujących niebezpieczne przestrzenie Strefy.","A nehéz páncélzat teherviselő rendszere hatékony eszköz a súlyelosztáshoz és a kényelemhez az állandó mozgás és a harci műveletek során. Ezt az innovatív rendszert úgy tervezték, hogy csökkentse a fáradtságot és gyors hozzáférést biztosítson a szükséges felszerelésekhez. A speciális zsebek, hurkok és rögzítések lehetővé teszik a felszerelés biztonságos rögzítését és a legszélsőségesebb helyzetekben is gyors hozzáférést a lényeges tárgyakhoz. A teherhordó rendszer nélkülözhetetlen felszerelés a Zóna veszélyes tereit felfedező leselkedők számára.","Il sistema di carico per armature pesanti è un mezzo efficace per la distribuzione del peso e il comfort durante i continui spostamenti e le operazioni di combattimento. Questo sistema innovativo è stato progettato per ridurre l'affaticamento e fornire un accesso rapido all'equipaggiamento necessario. Tasche, passanti e attacchi speciali consentono un montaggio sicuro dell'equipaggiamento e un rapido accesso agli oggetti essenziali nelle situazioni più estreme. Il sistema portante è un equipaggiamento indispensabile per gli stalker che esplorano gli spazi pericolosi della Zona.","El Sistema de Soporte de Carga para Blindados Pesados es un medio eficaz para la distribución del peso y la comodidad durante el movimiento constante y las operaciones de combate. Este innovador sistema está diseñado para reducir la fatiga y proporcionar un acceso rápido al equipo necesario. Los bolsillos, trabillas y enganches especiales permiten un montaje seguro del equipo y un acceso rápido a los artículos esenciales en las situaciones más extremas. El sistema de carga es una pieza indispensable del equipo de los acechadores que exploran los peligrosos espacios de la Zona.","Le système de port de charge de l'armure lourde est un moyen efficace de répartition du poids et de confort lors des mouvements constants et des opérations de combat. Ce système innovant est conçu pour réduire la fatigue et permettre un accès rapide à l'équipement nécessaire. Des poches, des boucles et des attaches spéciales permettent de fixer l'équipement en toute sécurité et d'accéder rapidement aux éléments essentiels dans les situations les plus extrêmes. Le système de portage est un équipement indispensable pour les traqueurs qui explorent les espaces dangereux de la Zone.","重型装甲负重系统是在持续移动和作战行动中分配重量和提高舒适度的有效手段。这一创新系统旨在减轻疲劳，并提供快速获取必要装备的途径。特殊的口袋、环和附件可以安全地安装装备，并在最极端的情况下快速取用必要的物品。对于在 ""区 ""内危险空间探索的潜行者来说，承重系统是不可或缺的装备。","ヘビーアーマー・ロードベアリングシステムは、絶え間ない移動と戦闘行動において、重量を分散し快適にする効果的な手段である。この革新的なシステムは、疲労を軽減し、必要な装備に素早くアクセスできるように設計されています。特殊なポケット、ループ、アタッチメントにより、最も過酷な状況でも装備品を確実に装着し、必要なアイテムに素早くアクセスできる。この耐荷重システムは、ゾーンの危険な空間を探索するストーカーにとって不可欠な装備品である。","O sistema de suporte de carga de blindagem pesada é um meio eficaz de distribuição de peso e conforto durante o movimento constante e operações de combate. Este sistema inovador foi concebido para reduzir a fadiga e proporcionar um acesso rápido ao equipamento necessário. Bolsos, presilhas e acessórios especiais permitem a montagem segura do equipamento e o acesso rápido a itens essenciais nas situações mais extremas. O sistema de suporte de carga é uma peça de equipamento indispensável para os perseguidores que exploram os espaços perigosos da Zona.","重型装甲负重系统是在持续移动和作战行动中分配重量和提高舒适度的有效手段。这一创新系统旨在减轻疲劳，并提供快速获取必要装备的途径。特殊的口袋、环和附件可以安全地安装装备，并在最极端的情况下快速取用必要的物品。对于在 ""区 ""内危险空间探索的潜行者来说，承重系统是不可或缺的装备。",
"STR_CfgVehicles_SFM_ExoVestFull_Base0","Heavy Equipment","Heavy Equipment","Těžká technika","Schwere Ausrüstung","Тяжелая экипировка","Ciężki sprzęt","Nehézgépek","Attrezzature pesanti","Maquinaria pesada","Matériel lourd","重型设备","重機","Equipamento pesado","重型设备",
"STR_CfgVehicles_SFM_ExoVestFull_Base1","The heavy bulletproof vest and load-bearing system of the heavy armor suit is a reliable combination of protection and functionality for stalkers exploring dangerous territories of the Zone. The bulletproof vest, made from durable materials, provides reliable protection against bullets and shrapnel, while allowing comfortable movement under constant threat. The load-bearing system helps distribute equipment weight and ensures quick access to necessary items, increasing the stalker's mobility and effectiveness in combat situations. This combination provides maximum protection and comfort in the most extreme conditions.","The heavy bulletproof vest and load-bearing system of the heavy armor suit is a reliable combination of protection and functionality for stalkers exploring dangerous territories of the Zone. The bulletproof vest, made from durable materials, provides reliable protection against bullets and shrapnel, while allowing comfortable movement under constant threat. The load-bearing system helps distribute equipment weight and ensures quick access to necessary items, increasing the stalker's mobility and effectiveness in combat situations. This combination provides maximum protection and comfort in the most extreme conditions.","Těžká neprůstřelná vesta a nosný systém těžkého pancéřového obleku jsou spolehlivou kombinací ochrany a funkčnosti pro stalkery zkoumající nebezpečná území Zóny. Neprůstřelná vesta vyrobená z odolných materiálů poskytuje spolehlivou ochranu proti střelám a střepinám a zároveň umožňuje pohodlný pohyb při neustálém ohrožení. Nosný systém pomáhá rozložit hmotnost vybavení a zajišťuje rychlý přístup k potřebným věcem, čímž zvyšuje mobilitu a efektivitu stalkera v bojových situacích. Tato kombinace poskytuje maximální ochranu a pohodlí i v těch nejextrémnějších podmínkách.","Die schwere kugelsichere Weste und das Tragesystem des schweren Panzeranzugs sind eine zuverlässige Kombination aus Schutz und Funktionalität für Stalker, die gefährliche Gebiete in der Zone erkunden. Die kugelsichere Weste aus strapazierfähigen Materialien bietet zuverlässigen Schutz vor Kugeln und Splittern und ermöglicht gleichzeitig eine komfortable Bewegung unter ständiger Bedrohung. Das Tragesystem hilft, das Gewicht der Ausrüstung zu verteilen und gewährleistet einen schnellen Zugriff auf die benötigten Gegenstände, was die Mobilität und Effektivität des Pirschers in Kampfsituationen erhöht. Diese Kombination bietet maximalen Schutz und Komfort unter den extremsten Bedingungen.","Тяжелый бронежилет и разгрузочная система тяжелого бронекостюма - надежное сочетание защиты и функциональности для сталкеров, исследующих опасные территории Зоны. Бронежилет, изготовленный из прочных материалов, обеспечивает надежную защиту от пуль и осколков, а также позволяет комфортно передвигаться в условиях постоянной угрозы. Разгрузочная система позволяет распределить вес снаряжения и обеспечить быстрый доступ к необходимым предметам, повышая мобильность и эффективность сталкера в боевых ситуациях. Это сочетание обеспечивает максимальную защиту и комфорт в самых экстремальных условиях.","Ciężka kamizelka kuloodporna i system nośny ciężkiego kombinezonu pancernego to niezawodne połączenie ochrony i funkcjonalności dla stalkerów eksplorujących niebezpieczne terytoria Strefy. Kamizelka kuloodporna, wykonana z wytrzymałych materiałów, zapewnia niezawodną ochronę przed kulami i odłamkami, jednocześnie umożliwiając wygodne poruszanie się w warunkach ciągłego zagrożenia. System nośny pomaga rozłożyć ciężar wyposażenia i zapewnia szybki dostęp do niezbędnych przedmiotów, zwiększając mobilność i skuteczność stalkera w sytuacjach bojowych. To połączenie zapewnia maksymalną ochronę i komfort w najbardziej ekstremalnych warunkach.","A nehéz páncélruha nehéz golyóálló mellénye és teherhordó rendszere a védelem és a funkcionalitás megbízható kombinációja a Zóna veszélyes területeit felfedező leselkedők számára. A tartós anyagokból készült golyóálló mellény megbízható védelmet nyújt a golyók és repeszek ellen, miközben lehetővé teszi a kényelmes mozgást állandó fenyegetettségben. A teherhordó rendszer segít a felszerelés súlyának elosztásában és biztosítja a szükséges tárgyakhoz való gyors hozzáférést, növelve a leselkedő mobilitását és hatékonyságát a harci helyzetekben. Ez a kombináció maximális védelmet és kényelmet biztosít a legszélsőségesebb körülmények között is.","Il giubbotto antiproiettile pesante e il sistema di supporto del carico dell'armatura pesante sono una combinazione affidabile di protezione e funzionalità per gli stalker che esplorano i territori pericolosi della Zona. Il giubbotto antiproiettile, realizzato con materiali resistenti, offre una protezione affidabile contro proiettili e schegge, consentendo al contempo di muoversi comodamente sotto costante minaccia. Il sistema di supporto del carico aiuta a distribuire il peso dell'equipaggiamento e garantisce un rapido accesso agli oggetti necessari, aumentando la mobilità e l'efficacia dello stalker in situazioni di combattimento. Questa combinazione offre la massima protezione e comfort nelle condizioni più estreme.","El chaleco antibalas pesado y el sistema de carga del traje blindado pesado son una combinación fiable de protección y funcionalidad para los acechadores que exploran los peligrosos territorios de la Zona. El chaleco antibalas, fabricado con materiales duraderos, proporciona una protección fiable contra balas y metralla, al tiempo que permite moverse cómodamente bajo una amenaza constante. El sistema de carga ayuda a distribuir el peso del equipo y garantiza un acceso rápido a los objetos necesarios, aumentando la movilidad y la eficacia del acechador en situaciones de combate. Esta combinación proporciona la máxima protección y comodidad en las condiciones más extremas.","Le gilet pare-balles lourd et le système de portage de la combinaison d'armure lourde constituent une combinaison fiable de protection et de fonctionnalité pour les traqueurs qui explorent les territoires dangereux de la zone. Le gilet pare-balles, fabriqué à partir de matériaux durables, offre une protection fiable contre les balles et les éclats d'obus, tout en permettant de se déplacer confortablement sous une menace constante. Le système de portage permet de répartir le poids de l'équipement et d'accéder rapidement aux objets nécessaires, ce qui accroît la mobilité et l'efficacité du rôdeur dans les situations de combat. Cette combinaison offre une protection et un confort maximums dans les conditions les plus extrêmes.","重型防弹背心和重型装甲服的承重系统是 ""区 ""内危险地带潜行者的可靠保护和功能性组合。防弹背心由耐用材料制成，可提供可靠的子弹和弹片防护，同时允许在持续受到威胁的情况下进行舒适的移动。承重系统有助于分散装备重量，确保快速拿取必要物品，提高潜行者的机动性和战斗力。这种组合可在最极端的条件下提供最大程度的保护和舒适性。","重防弾ベストと重装甲スーツの耐荷重システムは、ゾーンの危険な領域を探索するストーカーにとって、保護と機能性の信頼できる組み合わせです。耐久性のある素材で作られた防弾チョッキは、弾丸や榴散弾に対する信頼性の高い保護を提供すると同時に、絶え間ない脅威の中で快適な動きを可能にします。耐荷重システムは、装備品の重量を分散し、必要なアイテムに素早くアクセスできるようにすることで、戦闘状況におけるストーカーの機動性と有効性を高めます。この組み合わせは、最も過酷な状況下でも最大限の保護と快適性を提供する。","O colete à prova de balas pesado e o sistema de suporte de carga do fato de armadura pesada é uma combinação fiável de proteção e funcionalidade para os perseguidores que exploram os territórios perigosos da Zona. O colete à prova de bala, feito de materiais duráveis, proporciona uma proteção fiável contra balas e estilhaços, ao mesmo tempo que permite um movimento confortável sob ameaça constante. O sistema de suporte de carga ajuda a distribuir o peso do equipamento e garante um acesso rápido aos itens necessários, aumentando a mobilidade e a eficácia do perseguidor em situações de combate. Esta combinação proporciona a máxima proteção e conforto nas condições mais extremas.","重型防弹背心和重型装甲服的承重系统是 ""区 ""内危险地带潜行者的可靠保护和功能性组合。防弹背心由耐用材料制成，可提供可靠的子弹和弹片防护，同时允许在持续受到威胁的情况下进行舒适的移动。承重系统有助于分散装备重量，确保快速拿取必要物品，提高潜行者的机动性和战斗力。这种组合可在最极端的条件下提供最大程度的保护和舒适性。",
"STR_CfgVehicles_SFM_ExoVest_Base0","Heavy Armor Bulletproof Vest","Heavy Armor Bulletproof Vest","Neprůstřelná vesta Heavy Armor","Heavy Armor Kugelsichere Weste","Бронежилет тяжелого бронекостюма","Kamizelka kuloodporna Heavy Armor","Heavy Armor golyóálló mellény","Gilet antiproiettile Heavy Armor","Chaleco antibalas Heavy Armor","Gilet pare-balles Heavy Armor","重装甲防弹背心","ヘビーアーマー防弾チョッキ","Colete à prova de bala Heavy Armor","重装甲防弹背心",
"STR_CfgVehicles_SFM_ExoVest_Base1","The heavy armor bulletproof vest provides reliable protection in the harsh conditions of the Zone. Made from durable and wear-resistant materials, this vest ensures solid protection against bullets, shrapnel, and anomalous phenomena. Its comfortable fit and multiple pockets make it an ideal choice for stalkers exploring the dangerous territories of the Zone.","The heavy armor bulletproof vest provides reliable protection in the harsh conditions of the Zone. Made from durable and wear-resistant materials, this vest ensures solid protection against bullets, shrapnel, and anomalous phenomena. Its comfortable fit and multiple pockets make it an ideal choice for stalkers exploring the dangerous territories of the Zone.","Těžká neprůstřelná vesta poskytuje spolehlivou ochranu v drsných podmínkách zóny. Tato vesta je vyrobena z odolných materiálů odolných proti opotřebení a zajišťuje spolehlivou ochranu proti střelám, střepinám a anomálním jevům. Díky pohodlnému střihu a mnoha kapsám je ideální volbou pro stalkery zkoumající nebezpečná území Zóny.","Die kugelsichere Weste Heavy Armor bietet zuverlässigen Schutz unter den harten Bedingungen der Zone. Die Weste ist aus strapazierfähigen und verschleißfesten Materialien gefertigt und bietet soliden Schutz vor Kugeln, Schrapnellen und anomalen Phänomenen. Ihre bequeme Passform und die vielen Taschen machen sie zur idealen Wahl für Stalker, die die gefährlichen Gebiete der Zone erkunden.","Бронежилет тяжелого бронекостюма - надежная защита в суровых условиях Зоны. Изготовленный из прочных и износостойких материалов, этот бронежилет обеспечивает надежную защиту от пуль, осколков и аномальных явлений. Удобный крой и множество карманов делают его идеальным выбором для сталкеров, исследующих опасные территории Зоны.","Kamizelka kuloodporna Heavy Armor zapewnia niezawodną ochronę w trudnych warunkach Strefy. Wykonana z trwałych i odpornych na zużycie materiałów kamizelka zapewnia solidną ochronę przed pociskami, odłamkami i zjawiskami anomalnymi. Wygodne dopasowanie i liczne kieszenie sprawiają, że jest to idealny wybór dla stalkerów eksplorujących niebezpieczne terytoria Strefy.","A nehéz páncélzatú golyóálló mellény megbízható védelmet nyújt a zóna zord körülményei között. A tartós és kopásálló anyagokból készült mellény szilárd védelmet biztosít a golyókkal, repeszekkel és anomális jelenségekkel szemben. Kényelmes szabása és több zsebe ideális választássá teszi a Zóna veszélyes területeit felfedező leselkedők számára.","Il giubbotto antiproiettile heavy armor offre una protezione affidabile nelle condizioni difficili della Zona. Realizzato con materiali durevoli e resistenti all'usura, questo giubbotto assicura una solida protezione contro proiettili, schegge e fenomeni anomali. La sua vestibilità comoda e le tasche multiple lo rendono una scelta ideale per gli stalker che esplorano i pericolosi territori della Zona.","El chaleco antibalas de blindaje pesado proporciona una protección fiable en las duras condiciones de la Zona. Fabricado con materiales duraderos y resistentes al desgaste, este chaleco garantiza una sólida protección contra balas, metralla y fenómenos anómalos. Su cómodo ajuste y sus múltiples bolsillos lo convierten en una opción ideal para los acechadores que exploran los peligrosos territorios de la Zona.","Le gilet pare-balles à armure lourde offre une protection fiable dans les conditions difficiles de la zone. Fabriqué à partir de matériaux durables et résistants à l'usure, ce gilet assure une protection solide contre les balles, les éclats d'obus et les phénomènes anormaux. Sa coupe confortable et ses multiples poches en font un choix idéal pour les traqueurs qui explorent les territoires dangereux de la Zone.","重型装甲防弹背心可在 ""区 ""的恶劣条件下提供可靠的保护。该防弹背心采用耐用、耐磨的材料制成，可确保对子弹、弹片和异常现象提供坚实的保护。它舒适合身，有多个口袋，是探索 ""区 ""内危险区域的跟踪者的理想选择。","ヘビーアーマー防弾チョッキは、ゾーンの過酷な状況下で信頼性の高いプロテクションを提供します。耐久性と耐摩耗性に優れた素材で作られたこのベストは、銃弾、榴散弾、異常現象から確実に身を守ります。快適なフィット感と複数のポケットは、ゾーンの危険な領域を探索するストーカーにとって理想的な選択です。","O colete à prova de balas de armadura pesada oferece uma proteção fiável nas condições adversas da Zona. Feito de materiais duráveis e resistentes ao desgaste, este colete garante uma proteção sólida contra balas, estilhaços e fenómenos anómalos. O seu ajuste confortável e os vários bolsos fazem dele a escolha ideal para os perseguidores que exploram os perigosos territórios da Zona.","重型装甲防弹背心可在 ""区 ""的恶劣条件下提供可靠的保护。该防弹背心采用耐用、耐磨的材料制成，可确保对子弹、弹片和异常现象提供坚实的保护。它舒适合身，有多个口袋，是探索 ""区 ""内危险区域的跟踪者的理想选择。",
"STR_CfgVehicles_SFM_ExoVestArm_Base0","Heavy Bulletproof Vest","Heavy Bulletproof Vest","Těžká neprůstřelná vesta","Schwere kugelsichere Weste","Тяжелый бронежилет","Ciężka kamizelka kuloodporna","Nehéz golyóálló mellény","Gilet antiproiettile pesante","Chaleco antibalas pesado","Gilet pare-balles lourd","重型防弹背心","重い防弾チョッキ","Colete à prova de bala pesado","重型防弹背心",
