"Language","original","english","czech","german","russian","polish","hungarian","italian","spanish","french","chinese","japanese","portuguese","chinesesimp",
"STR_CfgVehicles_SFM_WFVest_Base1","The Wind of Freedom body armor provides reliable protection against bullets and shrapnel in high-risk conditions. Made from durable ballistic materials, it ensures dependable protection of the torso from bullet impacts and fragments. Comfortable adjustable straps allow for a secure and snug fit, providing reliable protection in combat conditions.","The Wind of Freedom body armor provides reliable protection against bullets and shrapnel in high-risk conditions. Made from durable ballistic materials, it ensures dependable protection of the torso from bullet impacts and fragments. Comfortable adjustable straps allow for a secure and snug fit, providing reliable protection in combat conditions.","Brnění Wind of Freedom poskytuje spolehlivou ochranu proti střelám a střepinám v rizikových podmínkách. Je vyrobena z odolných balistických materiálů a zajišťuje spolehlivou ochranu trupu před nárazy střel a střepin. Pohodlné nastavitelné popruhy umožňují bezpečné a těsné uchycení a poskytují spolehlivou ochranu v bojových podmínkách.","Die Wind of Freedom Schutzweste bietet zuverlässigen Schutz vor Kugeln und Splittern in risikoreichen Situationen. Sie besteht aus strapazierfähigen ballistischen Materialien und bietet zuverlässigen Schutz des Oberkörpers vor Geschosseinschlägen und -splittern. Die bequemen, verstellbaren Riemen sorgen für einen sicheren und passgenauen Sitz und bieten zuverlässigen Schutz unter Kampfbedingungen.","Бронежилет Ветер Свободы - это надежная защита от пуль и осколков в условиях увеличенной опасности. Изготовленный из прочных баллистических материалов, он обеспечивает надежную защиту торса от пулевых выстрелов и осколков. Удобные регулируемые ремни позволяют комфортно и плотно закрепить бронежилет, обеспечивая надежную защиту в боевых условиях.","Pancerz Wind of Freedom zapewnia niezawodną ochronę przed pociskami i odłamkami w warunkach wysokiego ryzyka. Wykonany z wytrzymałych materiałów balistycznych, zapewnia niezawodną ochronę tułowia przed uderzeniami i odłamkami pocisków. Wygodne regulowane paski pozwalają na bezpieczne i dokładne dopasowanie, zapewniając niezawodną ochronę w warunkach bojowych.","A Wind of Freedom testpáncél megbízható védelmet nyújt a lövedékek és repeszek ellen nagy kockázatú körülmények között. Tartós ballisztikus anyagokból készült, és megbízható védelmet biztosít a törzsnek a lövedékek és szilánkok becsapódásával szemben. A kényelmes, állítható pántok biztonságos és szoros illeszkedést tesznek lehetővé, megbízható védelmet nyújtva harci körülmények között.","L'armatura Wind of Freedom offre una protezione affidabile contro proiettili e schegge in condizioni di alto rischio. Realizzata con materiali balistici durevoli, garantisce una protezione affidabile del torso dagli impatti e dai frammenti dei proiettili. Le comode cinghie regolabili consentono una vestibilità sicura e aderente, garantendo una protezione affidabile in condizioni di combattimento.","El chaleco antibalas Wind of Freedom proporciona una protección fiable contra balas y metralla en condiciones de alto riesgo. Fabricado con materiales balísticos duraderos, garantiza una protección fiable del torso contra impactos y fragmentos de bala. Las cómodas correas ajustables permiten un ajuste seguro y ceñido, proporcionando una protección fiable en condiciones de combate.","Le gilet pare-balles Wind of Freedom offre une protection fiable contre les balles et les éclats d'obus dans des conditions à haut risque. Fabriquée à partir de matériaux balistiques durables, elle assure une protection fiable du torse contre les impacts et les fragments de balles. Les bretelles réglables confortables permettent un ajustement sûr et serré, offrant une protection fiable dans des conditions de combat.","自由之风防弹衣可在高风险条件下提供可靠的子弹和碎片防护。它由耐用的防弹材料制成，可确保可靠地保护躯干免受子弹冲击和碎片的伤害。舒适的可调节肩带可实现安全贴合，在战斗条件下提供可靠的保护。","フリーダムの風ボディアーマーは、危険性の高い状況下で銃弾や榴散弾に対する信頼性の高い保護を提供します。丈夫な弾道材料から作られて、それは弾丸の影響および片からの胴体の信頼できる保護を保障します。快適な調節可能な革紐は戦闘状態の信頼できる保護を提供するしっかりした、ぴったりした適合を可能にします。","O colete à prova de balas Wind of Freedom oferece uma proteção fiável contra balas e estilhaços em condições de alto risco. Fabricado com materiais balísticos duráveis, garante uma proteção fiável do tronco contra impactos e fragmentos de balas. As cintas ajustáveis e confortáveis permitem um ajuste seguro e confortável, proporcionando uma proteção fiável em condições de combate.","自由之风防弹衣可在高风险条件下提供可靠的子弹和碎片防护。它由耐用的防弹材料制成，可确保可靠地保护躯干免受子弹冲击和碎片的伤害。舒适的可调节肩带可实现安全贴合，在战斗条件下提供可靠的保护。",
"STR_CfgVehicles_SFM_WFGasMask0","Gas Mask","Gas Mask","Plynová maska","Gas Mask","Противогаз","Maska przeciwgazowa","Gázmaszk","Maschera antigas","Máscara antigás","Masque à gaz","防毒面具","ガスマスク","Máscara de gás","防毒面具",
"STR_CfgVehicles_SFM_WFGasMask1","A gas mask is reliable protection against harmful substances and contaminants in the anomaly zone. Made from special materials, it provides dependable air filtration and protection from harmful particles. Comfortable adjustable straps allow for a secure and snug fit on the face, ensuring reliable protection even in the most adverse conditions.","A gas mask is reliable protection against harmful substances and contaminants in the anomaly zone. Made from special materials, it provides dependable air filtration and protection from harmful particles. Comfortable adjustable straps allow for a secure and snug fit on the face, ensuring reliable protection even in the most adverse conditions.","Plynová maska je spolehlivou ochranou před škodlivými látkami a kontaminanty v zóně anomálie. Je vyrobena ze speciálních materiálů a poskytuje spolehlivou filtraci vzduchu a ochranu před škodlivými částicemi. Pohodlné nastavitelné popruhy umožňují bezpečné a těsné přilnutí k obličeji a zajišťují spolehlivou ochranu i v těch nejnepříznivějších podmínkách.","Eine Gasmaske ist ein zuverlässiger Schutz vor Schadstoffen und Verunreinigungen in der Anomaliezone. Aus speziellen Materialien gefertigt, bietet sie eine zuverlässige Luftfilterung und Schutz vor schädlichen Partikeln. Bequeme, verstellbare Bänder sorgen für einen sicheren und passgenauen Sitz auf dem Gesicht und gewährleisten einen zuverlässigen Schutz auch unter den widrigsten Bedingungen.","Противогаз - это надежная защита от вредных веществ и загрязнений в зоне аномалий. Изготовленный из специальных материалов, он обеспечивает надежную фильтрацию воздуха и защиту от вредных частиц. Удобные регулируемые ремни позволяют комфортно и плотно закрепить противогаз на лице, обеспечивая надежную защиту даже в самых неблагоприятных условиях.","Maska przeciwgazowa to niezawodna ochrona przed szkodliwymi substancjami i zanieczyszczeniami w strefie anomalii. Wykonana ze specjalnych materiałów, zapewnia niezawodną filtrację powietrza i ochronę przed szkodliwymi cząsteczkami. Wygodne regulowane paski pozwalają na bezpieczne i dokładne dopasowanie do twarzy, zapewniając niezawodną ochronę nawet w najbardziej niesprzyjających warunkach.","A gázálarc megbízható védelmet nyújt a káros anyagok és szennyeződések ellen az anomáliás zónában. Speciális anyagokból készült, megbízható légszűrést és védelmet nyújt a káros részecskékkel szemben. A kényelmes, állítható pántok lehetővé teszik a biztonságos és szoros illeszkedést az arcra, így még a legkedvezőtlenebb körülmények között is megbízható védelmet nyújt.","La maschera antigas è una protezione affidabile contro le sostanze nocive e i contaminanti nella zona di anomalia. Realizzata con materiali speciali, garantisce un filtraggio affidabile dell'aria e una protezione dalle particelle nocive. Le comode cinghie regolabili consentono una vestibilità sicura e aderente al viso, garantendo una protezione affidabile anche nelle condizioni più avverse.","Una máscara antigás es una protección fiable contra sustancias nocivas y contaminantes en la zona de anomalías. Fabricada con materiales especiales, proporciona una filtración de aire fiable y protección frente a partículas nocivas. Las cómodas correas ajustables permiten un ajuste seguro y ceñido a la cara, garantizando una protección fiable incluso en las condiciones más adversas.","Un masque à gaz est une protection fiable contre les substances nocives et les contaminants dans la zone d'anomalie. Fabriqué à partir de matériaux spéciaux, il assure une filtration fiable de l'air et une protection contre les particules nocives. Des sangles réglables confortables permettent un ajustement sûr et serré sur le visage, garantissant une protection fiable, même dans les conditions les plus défavorables.","防毒面具是防止异常区域有害物质和污染物的可靠保护装置。它由特殊材料制成，可提供可靠的空气过滤和有害微粒防护。舒适的可调节肩带可使面罩与脸部牢牢贴合，确保即使在最恶劣的条件下也能提供可靠的防护。","ガスマスクは、アノマリーゾーンでの有害物質や汚染物質から身を守る信頼性の高い防護具です。特殊な素材から作られ、信頼性の高い空気ろ過と有害な粒子からの保護を提供します。快適な調節可能ストラップにより、顔にしっかりとフィットし、最も過酷な条件下でも確実な防護を保証します。","Uma máscara de gás é uma proteção fiável contra substâncias nocivas e contaminantes na zona de anomalia. Fabricada com materiais especiais, proporciona uma filtragem de ar fiável e proteção contra partículas nocivas. As cintas ajustáveis e confortáveis permitem um ajuste seguro e confortável no rosto, garantindo uma proteção fiável mesmo nas condições mais adversas.","防毒面具是防止异常区域有害物质和污染物的可靠保护装置。它由特殊材料制成，可提供可靠的空气过滤和有害微粒防护。舒适的可调节肩带可使面罩与脸部牢牢贴合，确保即使在最恶劣的条件下也能提供可靠的防护。",
"STR_CfgVehicles_SFM_WinterJacket_Base0","Winter Jacket","Winter Jacket","Zimní bunda","Winterjacke","Зимняя куртка","Kurtka zimowa","Téli kabát","Giacca invernale","Chaqueta de invierno","Veste d'hiver","冬季夹克","ウインタージャケット","Casaco de inverno","冬季夹克",
"STR_CfgVehicles_SFM_WinterJacket_Base1","A winter jacket that's perfect for cold weather conditions, retains heat well, and provides excellent wind protection","A winter jacket that's perfect for cold weather conditions, retains heat well, and provides excellent wind protection","Zimní bunda, která je ideální do chladného počasí, dobře udržuje teplo a poskytuje vynikající ochranu proti větru.","Eine Winterjacke, die perfekt für kalte Wetterbedingungen geeignet ist, die Wärme gut speichert und ausgezeichneten Windschutz bietet","Зимняя куртка, отлично подойдет в условиях холодной погоды, хорошо сохраняет тепло, не продувается ветром","Kurtka zimowa, która jest idealna na zimne warunki pogodowe, dobrze zatrzymuje ciepło i zapewnia doskonałą ochronę przed wiatrem","Téli kabát, amely tökéletes a hideg időjárási körülményekhez, jól tartja a hőt és kiváló szélvédelmet biztosít.","Una giacca invernale perfetta per le condizioni climatiche fredde, che trattiene bene il calore e offre un'eccellente protezione dal vento.","Una chaqueta de invierno perfecta para condiciones climáticas frías, que retiene bien el calor y proporciona una excelente protección contra el viento.","Une veste d'hiver parfaite pour le froid, qui conserve bien la chaleur et offre une excellente protection contre le vent.","一款非常适合寒冷气候条件的冬季夹克，保暖性好，防风效果极佳","寒冷な天候に最適で、保温性に優れ、優れた防風性を発揮するウインタージャケット。","Um casaco de inverno perfeito para condições de tempo frio, que retém bem o calor e proporciona uma excelente proteção contra o vento","一款非常适合寒冷气候条件的冬季夹克，保暖性好，防风效果极佳",
"STR_CfgVehicles_SFM_WinterPants_Base0","Winter Pants","Winter Pants","Zimní kalhoty","Winter Pants","Зимние штаны","Spodnie zimowe","Téli nadrág","Pantaloni invernali","Pantalones de invierno","Pantalon d'hiver","冬季长裤","冬用パンツ","Calças de inverno","冬季长裤",
"STR_CfgVehicles_SFM_WinterPants_Base1","Winter pants with insulated lining, perfect for cold weather, retain heat well, don't restrict movement, and feature knee protection.","Winter pants with insulated lining, perfect for cold weather, retain heat well, don't restrict movement, and feature knee protection.","Zimní kalhoty se zateplenou podšívkou, ideální do chladného počasí, dobře udržují teplo, neomezují v pohybu a mají ochranu kolen.","Die Winterhose mit isolierendem Futter eignet sich perfekt für kaltes Wetter, speichert die Wärme gut, schränkt die Bewegungsfreiheit nicht ein und bietet einen Knieschutz.","Зимние штаны, с утепленной подкладкой, отлично подойдут в холодную погоду, сохраняют тепло, не сковывают движений, имеют защиту колен.","Zimowe spodnie z ocieplaną podszewką, idealne na chłodne dni, dobrze zatrzymują ciepło, nie ograniczają ruchów i mają ochronę kolan.","Szigetelt béléssel ellátott téli nadrág, amely tökéletes a hideg időjáráshoz, jól tartja a hőt, nem korlátozza a mozgást, és térdvédelmet biztosít.","Pantaloni invernali con fodera isolante, perfetti per il freddo, trattengono bene il calore, non limitano i movimenti e sono dotati di protezione per le ginocchia.","Pantalones de invierno con forro aislante, perfectos para el frío, retienen bien el calor, no limitan los movimientos y cuentan con protección para las rodillas.","Pantalon d'hiver avec doublure isolée, parfait pour le temps froid, qui conserve bien la chaleur, n'entrave pas les mouvements et protège les genoux.","冬季裤子带有保温衬里，非常适合寒冷天气穿着，保暖性能好，不会限制活动，还具有膝盖保护功能。","保温性に優れ、動きを妨げず、膝を保護するプロテクションを備えている。","Calças de inverno com forro isolante, perfeitas para o tempo frio, retêm bem o calor, não restringem os movimentos e têm proteção para os joelhos.","冬季裤子带有保温衬里，非常适合寒冷天气穿着，保暖性能好，不会限制活动，并具有膝部保护功能。",
"STR_CfgVehicles_SFM_ZakatJacket_Base0","Sunset Suit Jacket","Sunset Suit Jacket","Sako Sunset Suit","Sunset Suit Jacket","Куртка костюма Закат","Kurtka garniturowa Sunset","Sunset öltöny zakó","Giacca da abito Sunset","Traje de chaqueta Sunset","Sunset Suit Jacket","日落西装外套","サンセット・スーツ・ジャケット","Casaco de fato Sunset","日落西装外套",
"STR_CfgVehicles_SFM_ZakatJacket_Base1","The Sunset suit jacket is perfect for Zone conditions, retains heat well, made from durable fabric, and has high tear resistance","The Sunset suit jacket is perfect for Zone conditions, retains heat well, made from durable fabric, and has high tear resistance","Bunda Sunset je ideální do zónových podmínek, dobře udržuje teplo, je vyrobena z odolné tkaniny a má vysokou odolnost proti roztržení.","Die Sunset Anzugsjacke ist perfekt für die Bedingungen in der Zone, hält die Wärme gut zurück, ist aus strapazierfähigem Material und hat eine hohe Reißfestigkeit.","Крутка от костюма закат, отлично подходит для условий зоны, хорошо сохраняет тепло, выполнена из стойкой ткани, устойчива на разрыв","Kurtka garniturowa Sunset jest idealna na warunki strefowe, dobrze zatrzymuje ciepło, jest wykonana z trwałego materiału i ma wysoką odporność na rozdarcia","A Sunset öltönykabát tökéletes a zóna körülményeihez, jól tartja a hőt, tartós anyagból készült, és nagy szakadásállósággal rendelkezik.","La giacca Sunset è perfetta per le condizioni della zona, trattiene bene il calore, è realizzata in tessuto resistente e ha un'elevata resistenza agli strappi.","La chaqueta de traje Sunset es perfecta para las condiciones de la zona, retiene bien el calor, está fabricada con un tejido duradero y tiene una gran resistencia al desgarro","La veste de costume Sunset est parfaite pour les conditions de la zone, retient bien la chaleur, est fabriquée dans un tissu durable et présente une grande résistance à la déchirure.","Sunset 西装夹克非常适合 Zone 环境，保暖性好，采用耐用织物制成，抗撕裂性强。","サンセット・スーツ・ジャケットはゾーンコンディションに最適で、保温性に優れ、丈夫な生地で作られており、引き裂きにも強い。","O casaco de fato Sunset é perfeito para as condições da zona, retém bem o calor, é feito de um tecido durável e tem uma elevada resistência ao rasgamento","Sunset 西装夹克非常适合 Zone 环境，保暖性好，采用耐用织物制成，抗撕裂性强。",
"STR_CfgVehicles_SFM_ZakatPants_Base0","Sunset Suit Pants","Sunset Suit Pants","Kalhoty Sunset Suit","Sunset Suit Pants","Штаны от костюма Закат","Spodnie garniturowe Sunset","Sunset öltöny nadrág","Pantaloni della tuta Sunset","Pantalones de traje Sunset","Sunset Suit Pants","日落西装裤","サンセット・スーツ・パンツ","Calças de fato Sunset","日落西装裤",
"STR_CfgVehicles_SFM_ZakatPants_Base1","The Sunset suit pants are perfect for Zone conditions, allow freedom of movement, retain heat well, are tear-resistant and produce minimal noise for those who want to remain undetected","The Sunset suit pants are perfect for Zone conditions, allow freedom of movement, retain heat well, are tear-resistant and produce minimal noise for those who want to remain undetected","Oblekové kalhoty Sunset jsou ideální do zónových podmínek, umožňují volnost pohybu, dobře udržují teplo, jsou odolné proti roztržení a vydávají minimální hluk pro ty, kteří chtějí zůstat nepozorováni.","Die Sunset Anzughose ist perfekt für die Bedingungen in der Zone geeignet, bietet Bewegungsfreiheit, hält die Wärme gut zurück, ist reißfest und erzeugt nur minimale Geräusche für diejenigen, die unerkannt bleiben wollen.","Штаны от костюма Закат, отлично подходят для условий зоны, не стесняют движений, хорошо сохраняют тепло, устойчивы к разрыву и не издают лишнего шума для тех кто хочет остаться незаметным","Spodnie garniturowe Sunset są idealne do warunków strefowych, zapewniają swobodę ruchów, dobrze zatrzymują ciepło, są odporne na rozdarcia i wytwarzają minimalny hałas dla tych, którzy chcą pozostać niewykryci","A Sunset öltönynadrág tökéletes a zóna körülményeihez, lehetővé teszi a mozgás szabadságát, jól tartja a hőt, szakadásálló és minimális zajt kelt azok számára, akik észrevétlenek akarnak maradni.","I pantaloni della tuta Sunset sono perfetti per le condizioni di zona, consentono libertà di movimento, trattengono bene il calore, sono resistenti agli strappi e producono un rumore minimo per chi vuole non farsi notare.","Los pantalones de traje Sunset son perfectos para las condiciones de la zona, permiten libertad de movimientos, retienen bien el calor, son resistentes a los desgarros y producen un ruido mínimo para quienes desean pasar desapercibidos.","Le pantalon de costume Sunset est parfait pour les conditions de la zone, il permet une grande liberté de mouvement, retient bien la chaleur, est résistant à la déchirure et produit un minimum de bruit pour ceux qui veulent rester discrets.","Sunset 西装裤非常适合 Zone 环境，活动自如，保暖性好，抗撕裂，噪音极小，适合那些希望不被发现的人。","サンセットスーツパンツは、ゾーンコンディションに最適で、自由な動きを可能にし、保温性に優れ、破れにくく、気づかれないようにしたい人のために最小限のノイズしか発生させない。","As calças de fato Sunset são perfeitas para as condições da zona, permitem liberdade de movimentos, retêm bem o calor, são resistentes aos rasgões e produzem um ruído mínimo para quem quer passar despercebido","Sunset 西装裤非常适合 Zone 环境，活动自如，保暖性好，抗撕裂，噪音极小，适合那些希望不被发现的人。",
"STR_CfgVehicles_SFM_ZakatVest1_Base0","Sunset Bulletproof Vest","Sunset Bulletproof Vest","Neprůstřelná vesta Sunset","Sonnenuntergang kugelsichere Weste","Бронежилет Закат","Kamizelka kuloodporna Sunset","Sunset golyóálló mellény","Gilet antiproiettile Sunset","Chaleco antibalas Sunset","Gilet pare-balles Sunset","日落防弹背心","サンセット防弾チョッキ","Colete à prova de bala Sunset","日落防弹背心",
